{
  "clock_domain": "AUTOPILOT_MONOTONIC_BOOT",
  "dropped_event_count": 0,
  "epoch": "synthetic_zero_integer_milliseconds",
  "events": [
    {
      "correlation_id": "PX4-MC-RCLOSS-001--boundary_exact_legal",
      "event_id": "synthetic_ap_valuation",
      "fresh": true,
      "scope_id": "PX4-MC-RCLOSS-001",
      "seq": 0,
      "source": "SYNTHETIC_MONITOR_VALIDATION_NOT_FIRMWARE_TRACE",
      "time": 0,
      "values": {
        "manual_control_lost": false,
        "manual_gap_start": false,
        "rc_loss_applicable": false
      }
    },
    {
      "correlation_id": "PX4-MC-RCLOSS-001--boundary_exact_legal",
      "event_id": "synthetic_ap_valuation",
      "fresh": true,
      "scope_id": "PX4-MC-RCLOSS-001",
      "seq": 1,
      "source": "SYNTHETIC_MONITOR_VALIDATION_NOT_FIRMWARE_TRACE",
      "time": 1000,
      "values": {
        "manual_control_lost": false,
        "manual_gap_start": true,
        "rc_loss_applicable": true
      }
    },
    {
      "correlation_id": "PX4-MC-RCLOSS-001--boundary_exact_legal",
      "event_id": "synthetic_ap_valuation",
      "fresh": true,
      "scope_id": "PX4-MC-RCLOSS-001",
      "seq": 2,
      "source": "SYNTHETIC_MONITOR_VALIDATION_NOT_FIRMWARE_TRACE",
      "time": 1499,
      "values": {
        "manual_control_lost": false,
        "manual_gap_start": false,
        "rc_loss_applicable": true
      }
    },
    {
      "correlation_id": "PX4-MC-RCLOSS-001--boundary_exact_legal",
      "event_id": "synthetic_ap_valuation",
      "fresh": true,
      "scope_id": "PX4-MC-RCLOSS-001",
      "seq": 3,
      "source": "SYNTHETIC_MONITOR_VALIDATION_NOT_FIRMWARE_TRACE",
      "time": 1500,
      "values": {
        "manual_control_lost": true,
        "manual_gap_start": false,
        "rc_loss_applicable": true
      }
    },
    {
      "correlation_id": "PX4-MC-RCLOSS-001--boundary_exact_legal",
      "event_id": "synthetic_ap_valuation",
      "fresh": true,
      "scope_id": "PX4-MC-RCLOSS-001",
      "seq": 4,
      "source": "SYNTHETIC_MONITOR_VALIDATION_NOT_FIRMWARE_TRACE",
      "time": 2500,
      "values": {
        "manual_control_lost": false,
        "manual_gap_start": false,
        "rc_loss_applicable": true
      }
    }
  ],
  "notes": "Closed eventual lower bound and open pre-threshold prohibition make the exact threshold legal. No epsilon or tolerance is introduced. Source seconds are rescaled exactly to integer milliseconds. T-1 and T+1 are distinct synthetic clock ticks used only to exercise open/closed endpoints; they do not move a property boundary.",
  "property_id": "PX4-MC-RCLOSS-001",
  "schema_version": "1.0",
  "trace_id": "PX4-MC-RCLOSS-001--boundary_exact_legal"
}
