{
  "clock_domain": "AUTOPILOT_MONOTONIC_BOOT",
  "dropped_event_count": 0,
  "epoch": "synthetic_zero_integer_milliseconds",
  "events": [
    {
      "correlation_id": "ARD-ROVER-RCFS-001--vacuous_trigger_control",
      "event_id": "synthetic_ap_valuation",
      "fresh": true,
      "scope_id": "ARD-ROVER-RCFS-001",
      "seq": 0,
      "source": "SYNTHETIC_MONITOR_VALIDATION_NOT_FIRMWARE_TRACE",
      "time": 0,
      "values": {
        "configured_failsafe_action": false,
        "low_throttle_start": false,
        "throttle_fs_enabled": false,
        "valid_rc_frames": false
      }
    },
    {
      "correlation_id": "ARD-ROVER-RCFS-001--vacuous_trigger_control",
      "event_id": "synthetic_ap_valuation",
      "fresh": true,
      "scope_id": "ARD-ROVER-RCFS-001",
      "seq": 1,
      "source": "SYNTHETIC_MONITOR_VALIDATION_NOT_FIRMWARE_TRACE",
      "time": 1000,
      "values": {
        "configured_failsafe_action": false,
        "low_throttle_start": false,
        "throttle_fs_enabled": true,
        "valid_rc_frames": true
      }
    },
    {
      "correlation_id": "ARD-ROVER-RCFS-001--vacuous_trigger_control",
      "event_id": "synthetic_ap_valuation",
      "fresh": true,
      "scope_id": "ARD-ROVER-RCFS-001",
      "seq": 2,
      "source": "SYNTHETIC_MONITOR_VALIDATION_NOT_FIRMWARE_TRACE",
      "time": 2499,
      "values": {
        "configured_failsafe_action": true,
        "low_throttle_start": false,
        "throttle_fs_enabled": true,
        "valid_rc_frames": true
      }
    },
    {
      "correlation_id": "ARD-ROVER-RCFS-001--vacuous_trigger_control",
      "event_id": "synthetic_ap_valuation",
      "fresh": true,
      "scope_id": "ARD-ROVER-RCFS-001",
      "seq": 3,
      "source": "SYNTHETIC_MONITOR_VALIDATION_NOT_FIRMWARE_TRACE",
      "time": 2500,
      "values": {
        "configured_failsafe_action": false,
        "low_throttle_start": false,
        "throttle_fs_enabled": true,
        "valid_rc_frames": true
      }
    },
    {
      "correlation_id": "ARD-ROVER-RCFS-001--vacuous_trigger_control",
      "event_id": "synthetic_ap_valuation",
      "fresh": true,
      "scope_id": "ARD-ROVER-RCFS-001",
      "seq": 4,
      "source": "SYNTHETIC_MONITOR_VALIDATION_NOT_FIRMWARE_TRACE",
      "time": 3500,
      "values": {
        "configured_failsafe_action": false,
        "low_throttle_start": false,
        "throttle_fs_enabled": true,
        "valid_rc_frames": true
      }
    }
  ],
  "notes": "Control trace disables the trigger while retaining the early response; it is paired with the non-vacuous counterexample. No epsilon or tolerance is introduced. Source seconds are rescaled exactly to integer milliseconds. T-1 and T+1 are distinct synthetic clock ticks used only to exercise open/closed endpoints; they do not move a property boundary.",
  "property_id": "ARD-ROVER-RCFS-001",
  "schema_version": "1.0",
  "trace_id": "ARD-ROVER-RCFS-001--vacuous_trigger_control"
}
