{
  "clock_domain": "UNKNOWN",
  "dropped_event_count": 0,
  "epoch": "synthetic_zero_integer_milliseconds",
  "events": [
    {
      "correlation_id": "PX4-MC-GCSLOSS-002--positive_after_threshold",
      "event_id": "synthetic_ap_valuation",
      "fresh": true,
      "scope_id": "PX4-MC-GCSLOSS-002",
      "seq": 0,
      "source": "SYNTHETIC_MONITOR_VALIDATION_NOT_FIRMWARE_TRACE",
      "time": 0,
      "values": {
        "data_link_loss_gap_start": false,
        "dl_loss_applicable": false,
        "gcs_connection_lost": false
      }
    },
    {
      "correlation_id": "PX4-MC-GCSLOSS-002--positive_after_threshold",
      "event_id": "synthetic_ap_valuation",
      "fresh": true,
      "scope_id": "PX4-MC-GCSLOSS-002",
      "seq": 1,
      "source": "SYNTHETIC_MONITOR_VALIDATION_NOT_FIRMWARE_TRACE",
      "time": 1000,
      "values": {
        "data_link_loss_gap_start": true,
        "dl_loss_applicable": true,
        "gcs_connection_lost": false
      }
    },
    {
      "correlation_id": "PX4-MC-GCSLOSS-002--positive_after_threshold",
      "event_id": "synthetic_ap_valuation",
      "fresh": true,
      "scope_id": "PX4-MC-GCSLOSS-002",
      "seq": 2,
      "source": "SYNTHETIC_MONITOR_VALIDATION_NOT_FIRMWARE_TRACE",
      "time": 10999,
      "values": {
        "data_link_loss_gap_start": false,
        "dl_loss_applicable": true,
        "gcs_connection_lost": false
      }
    },
    {
      "correlation_id": "PX4-MC-GCSLOSS-002--positive_after_threshold",
      "event_id": "synthetic_ap_valuation",
      "fresh": true,
      "scope_id": "PX4-MC-GCSLOSS-002",
      "seq": 3,
      "source": "SYNTHETIC_MONITOR_VALIDATION_NOT_FIRMWARE_TRACE",
      "time": 11000,
      "values": {
        "data_link_loss_gap_start": false,
        "dl_loss_applicable": true,
        "gcs_connection_lost": false
      }
    },
    {
      "correlation_id": "PX4-MC-GCSLOSS-002--positive_after_threshold",
      "event_id": "synthetic_ap_valuation",
      "fresh": true,
      "scope_id": "PX4-MC-GCSLOSS-002",
      "seq": 4,
      "source": "SYNTHETIC_MONITOR_VALIDATION_NOT_FIRMWARE_TRACE",
      "time": 12000,
      "values": {
        "data_link_loss_gap_start": false,
        "dl_loss_applicable": true,
        "gcs_connection_lost": true
      }
    },
    {
      "correlation_id": "PX4-MC-GCSLOSS-002--positive_after_threshold",
      "event_id": "synthetic_ap_valuation",
      "fresh": true,
      "scope_id": "PX4-MC-GCSLOSS-002",
      "seq": 5,
      "source": "SYNTHETIC_MONITOR_VALIDATION_NOT_FIRMWARE_TRACE",
      "time": 13000,
      "values": {
        "data_link_loss_gap_start": false,
        "dl_loss_applicable": true,
        "gcs_connection_lost": false
      }
    }
  ],
  "notes": "Response occurs strictly after the lower threshold and no response occurs before it. No epsilon or tolerance is introduced. Source seconds are rescaled exactly to integer milliseconds. T-1 and T+1 are distinct synthetic clock ticks used only to exercise open/closed endpoints; they do not move a property boundary.",
  "property_id": "PX4-MC-GCSLOSS-002",
  "schema_version": "1.0",
  "trace_id": "PX4-MC-GCSLOSS-002--positive_after_threshold"
}
