{
  "clock_domain": "AUTOPILOT_MONOTONIC_BOOT",
  "dropped_event_count": 0,
  "epoch": "synthetic_zero_integer_milliseconds",
  "events": [
    {
      "correlation_id": "ARD-COPTER-GCS-001--too_early_one_tick",
      "event_id": "synthetic_ap_valuation",
      "fresh": true,
      "scope_id": "ARD-COPTER-GCS-001",
      "seq": 0,
      "source": "SYNTHETIC_MONITOR_VALIDATION_NOT_FIRMWARE_TRACE",
      "time": 0,
      "values": {
        "gcs_failsafe_event": false,
        "gcs_fs_enabled": false,
        "gcs_heartbeat_gap_start": false,
        "gcs_heartbeat_seen_before": false
      }
    },
    {
      "correlation_id": "ARD-COPTER-GCS-001--too_early_one_tick",
      "event_id": "synthetic_ap_valuation",
      "fresh": true,
      "scope_id": "ARD-COPTER-GCS-001",
      "seq": 1,
      "source": "SYNTHETIC_MONITOR_VALIDATION_NOT_FIRMWARE_TRACE",
      "time": 1000,
      "values": {
        "gcs_failsafe_event": false,
        "gcs_fs_enabled": true,
        "gcs_heartbeat_gap_start": true,
        "gcs_heartbeat_seen_before": true
      }
    },
    {
      "correlation_id": "ARD-COPTER-GCS-001--too_early_one_tick",
      "event_id": "synthetic_ap_valuation",
      "fresh": true,
      "scope_id": "ARD-COPTER-GCS-001",
      "seq": 2,
      "source": "SYNTHETIC_MONITOR_VALIDATION_NOT_FIRMWARE_TRACE",
      "time": 5999,
      "values": {
        "gcs_failsafe_event": true,
        "gcs_fs_enabled": true,
        "gcs_heartbeat_gap_start": false,
        "gcs_heartbeat_seen_before": true
      }
    },
    {
      "correlation_id": "ARD-COPTER-GCS-001--too_early_one_tick",
      "event_id": "synthetic_ap_valuation",
      "fresh": true,
      "scope_id": "ARD-COPTER-GCS-001",
      "seq": 3,
      "source": "SYNTHETIC_MONITOR_VALIDATION_NOT_FIRMWARE_TRACE",
      "time": 6000,
      "values": {
        "gcs_failsafe_event": false,
        "gcs_fs_enabled": true,
        "gcs_heartbeat_gap_start": false,
        "gcs_heartbeat_seen_before": true
      }
    },
    {
      "correlation_id": "ARD-COPTER-GCS-001--too_early_one_tick",
      "event_id": "synthetic_ap_valuation",
      "fresh": true,
      "scope_id": "ARD-COPTER-GCS-001",
      "seq": 4,
      "source": "SYNTHETIC_MONITOR_VALIDATION_NOT_FIRMWARE_TRACE",
      "time": 7000,
      "values": {
        "gcs_failsafe_event": false,
        "gcs_fs_enabled": true,
        "gcs_heartbeat_gap_start": false,
        "gcs_heartbeat_seen_before": true
      }
    }
  ],
  "notes": "Response occurs one exact monitor tick before the threshold. No epsilon or tolerance is introduced. Source seconds are rescaled exactly to integer milliseconds. T-1 and T+1 are distinct synthetic clock ticks used only to exercise open/closed endpoints; they do not move a property boundary.",
  "property_id": "ARD-COPTER-GCS-001",
  "schema_version": "1.0",
  "trace_id": "ARD-COPTER-GCS-001--too_early_one_tick"
}
